<?xml version="1.0" encoding="utf-8" standalone="no"?>
<!DOCTYPE featureDefinitions SYSTEM "../featureDefinitions.dtd">
<featureDefinitions name="8bitZeroCounter" iconName="16bitCounter" helpIndex="">

  <userControlGroup name="none" caption="none">
    <userControlSubGroup name="none" caption="none">

      <userControl name="applyButton">
        <dialogConfig type="applyButton" caption="none"/>
        <userAction name="apply">
          <claimResource type="pin" pin="T0CKI" polarity="Inp"/>
          <claimResource type="register" registerField="ANS2" value="0"/>
          <claimResource type="register" registerField="T0CS" value="1"/>
        </userAction>
      </userControl>

    </userControlSubGroup>
  </userControlGroup>

  <userControlGroup name="General" caption="General">
    <userControlSubGroup name="none" caption="none">

      <userControl name="Prescale">
        <dialogConfig type="CB" caption="Timer Prescale">
          <selection name="setTo0" value="1:1"/>
          <selection name="setTo1" value="1:2"/>
          <selection name="setTo2" value="1:4"/>
          <selection name="setTo3" value="1:8"/>
          <selection name="setTo4" value="1:16"/>
          <selection name="setTo5" value="1:32"/>
          <selection name="setTo6" value="1:64"/>
          <selection name="setTo7" value="1:128"/>
          <selection name="setTo8" value="1:256"/>
        </dialogConfig>
        <userAction>
          <claimResource type="register" registerField="PS" value="111"/>
          <claimResource type="register" registerField="PSA" value="0"/>
        </userAction>
        <userAction>
          <claimResource type="register" registerField="PS" value="110"/>
          <claimResource type="register" registerField="PSA" value="0"/>
        </userAction>
        <userAction>
          <claimResource type="register" registerField="PS" value="101"/>
          <claimResource type="register" registerField="PSA" value="0"/>
        </userAction>
        <userAction>
          <claimResource type="register" registerField="PS" value="100"/>
          <claimResource type="register" registerField="PSA" value="0"/>
        </userAction>
        <userAction>
          <claimResource type="register" registerField="PS" value="011"/>
          <claimResource type="register" registerField="PSA" value="0"/>
        </userAction>
        <userAction>
          <claimResource type="register" registerField="PS" value="010"/>
          <claimResource type="register" registerField="PSA" value="0"/>
        </userAction>
        <userAction>
          <claimResource type="register" registerField="PS" value="001"/>
          <claimResource type="register" registerField="PSA" value="0"/>
        </userAction>
        <userAction>
          <claimResource type="register" registerField="PS" value="000"/>
          <claimResource type="register" registerField="PSA" value="0"/>
        </userAction>
        <userAction>
          <claimResource type="register" registerField="PSA" value="1"/>
        </userAction>
      </userControl>

      <userControl name="TriggeringEdge">
        <dialogConfig type="CB" caption="Trigger on Edge">
          <selection name="Falling" value="Falling"/>
          <selection name="Rising" value="Rising"/>
        </dialogConfig>
        <userAction>
          <claimResource type="register" registerField="T0SE" value="0"/>
        </userAction>
        <userAction>
          <claimResource type="register" registerField="T0SE" value="1"/>
        </userAction>
      </userControl>

    </userControlSubGroup>
  </userControlGroup>

  <userControlGroup name="Interrupt" caption="Interrupt">
    <userControlSubGroup name="none" caption="none">

      <userControl name="EnableInterrupt" enableForInt="T0">
        <dialogConfig type="CK" caption="Enable Interrupt"/>
        <userAction name="enable">
          <claimResource type="register" registerField="T0IE" value="1"/>
        </userAction>
        <userAction name="disable">
          <claimResource type="register" registerField="T0IE" value="0"/>
        </userAction>
      </userControl>

    </userControlSubGroup>
  </userControlGroup>

</featureDefinitions>
